Question,Response
"What is personal finance?","Personal finance refers to the management of an individual's financial resources, including budgeting, saving, investing, and planning for retirement and other financial goals."
"How can I create a budget?","Creating a budget involves analyzing your income and expenses to allocate funds for various categories such as housing, groceries, savings, and entertainment. It helps you manage your spending and save for your financial goals."
"What are the different types of insurance?","There are various types of insurance, including health insurance, life insurance, auto insurance, home insurance, and disability insurance. Each type provides coverage for specific risks and situations."
"What are some common investment options?","Common investment options include stocks, bonds, mutual funds, real estate, and exchange-traded funds (ETFs). These investments offer different levels of risk and potential returns, allowing individuals to diversify their portfolio."
"How do I plan for retirement?","Planning for retirement involves setting a retirement goal, estimating your retirement expenses, saving and investing regularly, considering employer-sponsored retirement plans, and understanding your Social Security benefits to ensure a comfortable retirement."
"How can I improve my credit score?","Improving your credit score involves paying bills on time, reducing credit card balances, avoiding opening too many new accounts, and monitoring your credit report for errors."
"What are the steps to buying a home?","The steps to buying a home include determining your budget, getting pre-approved for a mortgage, finding a real estate agent, searching for a home, making an offer, completing inspections, and closing the deal."
"How can I save for an emergency fund?","To save for an emergency fund, create a budget to allocate a portion of your income, set a savings goal, automate your savings, reduce unnecessary expenses, and consider additional income sources."
"What are the key elements of a retirement plan?","A retirement plan typically includes setting a retirement age, estimating retirement expenses, calculating the required savings, selecting appropriate investment options, and periodically reviewing and adjusting the plan."
"What is the difference between a 401(k) and an IRA?","A 401(k) is an employer-sponsored retirement savings plan, often with employer matching contributions, while an IRA (Individual Retirement Account) is a personal retirement savings account that allows individuals to contribute independently."
"How can I reduce my debt?","Reducing debt involves creating a debt repayment plan, prioritizing high-interest debts, paying more than the minimum payments, negotiating with creditors for lower interest rates, and considering debt consolidation or settlement options."
"What is the importance of diversifying investments?","Diversifying investments helps spread risk by investing in a variety of asset classes, reducing the impact of a decline in any one investment. It aims to achieve a balance between potential returns and risk management."
"What is the difference between a traditional IRA and a Roth IRA?","A traditional IRA allows individuals to contribute pre-tax income and pay taxes upon withdrawal, while a Roth IRA allows individuals to contribute after-tax income and withdraw funds tax-free in retirement."
"What is the difference between a stock and a bond?","A stock represents ownership in a company, while a bond represents a loan to a company or government entity. Stocks typically offer higher potential returns but also carry higher risk, while bonds offer lower potential returns but lower risk."
"What is the difference between a credit card and a debit card?","A credit card allows individuals to borrow money from a financial institution and pay it back over time, while a debit card allows individuals to spend money directly from their bank account."
"What are some common tax deductions?","Common tax deductions include mortgage interest, student loan interest, medical expenses, charitable contributions, and state and local taxes paid."
"How can I start investing with a small budget?","You can start investing with a small budget by considering fractional shares, micro-investment apps, robo-advisors, and low-cost investment options like ETFs and index funds."
"How can I plan for my children's education?","Planning for your children's education involves starting a dedicated savings account, exploring tax-advantaged education savings plans like 529 plans, and considering scholarships, grants, and financial aid options."
"What is the difference between a traditional IRA and a Roth IRA?","A traditional IRA offers tax-deferred contributions and tax deductions for contributions, while a Roth IRA offers tax-free withdrawals and contributions made with after-tax dollars."
"How can I negotiate a better salary?","Negotiating a better salary involves researching salary ranges for your position, presenting your accomplishments and value to the company, and being prepared to negotiate additional benefits or perks."
"What are the key factors in determining my risk tolerance for investments?","Key factors in determining risk tolerance include your financial goals, time horizon, comfort with volatility, overall financial situation, and investment knowledge and experience."
"What are some strategies to save on everyday expenses?","Strategies to save on everyday expenses include creating a budget, meal planning, shopping for discounts and using coupons, canceling unused subscriptions, and finding alternative transportation options."
"What is a budget?","A budget is a plan that outlines what money you expect to earn or receive (your income) and how you will save it or spend it (your expenses) for a set period of time. Creating a budget allows you to align your spending with your financial goals, track your money, and make informed financial decisions."
"How do I start budgeting?","To start budgeting, list all of your expenses for the month and categorize them into essentials like housing, food, transportation, utilities, and discretionary expenses like entertainment and dining out. Then look at your income and see how much you can allocate towards essential and discretionary categories."
"Why is budgeting important?","Budgeting is essential because it helps you control your finances, save for the future, and avoid overspending. It gives you a clear picture of where your money is going and allows you to make adjustments to achieve your financial goals."
"What are fixed expenses?","Fixed expenses are regular, recurring costs that don't typically change from month to month. Examples include rent or mortgage payments, car loans, and insurance premiums."
"What are variable expenses?","Variable expenses are costs that can change from month to month. These might include groceries, dining out, entertainment, and discretionary spending."
"How can I reduce my expenses?","You can reduce your expenses by cutting back on discretionary spending, finding more cost-effective alternatives, and negotiating lower rates on bills like utilities and insurance."
"What is an emergency fund?","An emergency fund is a savings account set aside for unexpected expenses like medical bills, car repairs, or job loss. It provides a financial safety net and helps you avoid going into debt during emergencies."
"How much should I save for an emergency fund?","Financial experts recommend saving at least three to six months' worth of living expenses in your emergency fund. However, the exact amount may vary depending on your individual circumstances."
"What is the 50/30/20 rule?","The 50/30/20 rule is a simple budgeting guideline. It suggests that you allocate 50% of your income to needs (essential expenses), 30% to wants (discretionary spending), and 20% to savings or debt repayment."
"How can I pay off debt faster?","You can pay off debt faster by creating a debt repayment plan, allocating extra funds to your debts, and considering strategies like the debt snowball or debt avalanche methods."
"What is a credit score?","A credit score is a numerical representation of your creditworthiness. Lenders use it to assess the risk of lending to you. It's based on your credit history, including your payment history, credit utilization, and other factors."
"How can I improve my credit score?","To improve your credit score, make on-time payments, reduce credit card balances, avoid opening too many new accounts, and regularly review your credit report for errors."
"What is compound interest?","Compound interest is when interest is calculated on both the initial principal amount and any accumulated interest from previous periods. It can work for you when saving and investing or against you when borrowing money."
"How can I start investing?","You can start investing by setting clear financial goals, determining your risk tolerance, and then opening an investment account. Consider options like stocks, bonds, mutual funds, or exchange-traded funds (ETFs)."
"What is a 401(k)?","A 401(k) is a retirement savings plan offered by employers in the United States. You can contribute a portion of your salary to this account, often with tax advantages, to save for retirement."
"What is a Roth IRA?","A Roth IRA is an individual retirement account that offers tax-free withdrawals in retirement. You contribute after-tax money, and your investments grow tax-free."
"How can I set financial goals?","Setting financial goals involves defining what you want to achieve financially, whether it's saving for a house, paying off debt, or retiring comfortably. Write down your goals, create a plan, and track your progress."
"What is the difference between saving and investing?","Saving involves putting money aside in low-risk, easily accessible accounts like a savings account. Investing entails putting money into assets like stocks, bonds, or real estate to potentially earn higher returns, but it carries more risk."
"Should I hire a financial advisor?","Hiring a financial advisor can be beneficial if you have complex financial needs, lack financial expertise, or want personalized advice. Ensure you choose a qualified, reputable advisor."
"How can I protect my financial future?","To protect your financial future, focus on building an emergency fund, insuring yourself and your assets, and making wise investment decisions. Additionally, continuously educate yourself about personal finance."
"What is a credit report, and how do I obtain it?","A credit report is a detailed record of your credit history. You can obtain a free copy of your credit report from each of the three major credit bureaus (Equifax, Experian, and TransUnion) once a year at AnnualCreditReport.com."
"How can I reduce my taxes legally?","You can legally reduce your taxes by taking advantage of tax deductions and credits, contributing to tax-advantaged retirement accounts, and understanding tax-efficient investment strategies."
"What is the importance of diversification in investing?","Diversification involves spreading your investments across different asset classes to reduce risk. It's essential because it helps protect your portfolio from significant losses if one investment performs poorly."
"What is a 529 plan?","A 529 plan is a tax-advantaged savings plan designed to encourage saving for future education expenses. It can be used to cover qualified educational costs, such as college tuition and expenses."
"How can I teach my children about personal finance?","You can teach your children about personal finance by setting a good example, involving them in financial discussions, giving them an allowance to manage, and explaining basic financial concepts."
"What is the difference between a traditional IRA and a Roth IRA?","The main difference is in how they're taxed. Traditional IRAs offer tax deductions on contributions but are taxed upon withdrawal. Roth IRAs are funded with after-tax money and provide tax-free withdrawals in retirement."
"What is the importance of an estate plan?","An estate plan outlines how your assets will be managed and distributed after your passing. It's crucial for ensuring your wishes are followed, minimizing taxes, and providing for your loved ones."
"How can I protect my personal information and financial security online?","Protect your personal information by using strong, unique passwords, enabling two-factor authentication, being cautious with emails and websites, and regularly monitoring your financial accounts for suspicious activity."
"What is the difference between a stock and a bond?","Stocks represent ownership in a company and offer the potential for capital appreciation. Bonds are debt securities where you lend money to an entity and receive periodic interest payments until the bond matures."
"What is a will and how do I create one?","A will is a legal document that specifies how you want your assets to be distributed after your death. You can create one with the help of an attorney or using DIY will-making software."
"How can I avoid impulse spending?","To avoid impulse spending, create a shopping list, set a budget, wait 24 hours before making a non-essential purchase, and identify your spending triggers and habits."
"What is the rule of 72 in investing?","The rule of 72 is a quick way to estimate how long it will take for an investment to double in value. Simply divide 72 by the annual interest rate to get an approximate doubling time."
"What is a certificate of deposit (CD)?","A certificate of deposit is a time deposit with a fixed term and a fixed interest rate. It's a low-risk, interest-bearing savings option offered by banks and credit unions."
"How can I deal with financial setbacks or unexpected expenses?","Dealing with financial setbacks involves prioritizing your expenses, seeking additional income or assistance, and, if necessary, adjusting your budget and financial plan to accommodate the unexpected costs."
"What is the significance of an emergency budget?","An emergency budget is a scaled-down version of your regular budget designed to help you navigate financial crises. It focuses on covering essential expenses while temporarily cutting non-essential spending."
"How can I save money on everyday expenses?","You can save money on everyday expenses by shopping smartly, cooking at home, using coupons, taking advantage of loyalty programs, and comparing prices before making purchases."
"What is financial independence, retire early (FIRE)?","FIRE is a movement that encourages achieving financial independence and retiring early by saving aggressively and reducing living expenses. It aims to provide more control and flexibility in life."
"How can I make the most of employee benefits, like a 401(k) or health savings account (HSA)?","To make the most of employee benefits, understand your options, contribute enough to get any employer match, and utilize tax-advantaged accounts like a 401(k) or HSA to save and invest for the future."
"What is dollar-cost averaging in investing?","Dollar-cost averaging is an investment strategy where you regularly invest a fixed amount of money into a specific investment, regardless of its current price. It can help reduce the impact of market volatility."
"What is a financial statement, and how do I create one?","A financial statement is a summary of your financial position, including your assets, liabilities, and net worth. You can create one by listing your assets and their values and then listing your liabilities."
"How can I negotiate better financial terms with creditors or service providers?","To negotiate better terms with creditors or service providers, be polite and persistent, explain your situation, and propose mutually beneficial solutions like lower interest rates or extended payment plans."
"What is the role of insurance in personal finance?","Insurance provides financial protection by covering losses in the event of accidents, illnesses, or other unforeseen circumstances. It helps prevent significant financial setbacks."
"What is the difference between a traditional savings account and a high-yield savings account?","Traditional savings accounts offer lower interest rates and are typically offered by brick-and-mortar banks. High-yield savings accounts offer higher interest rates and are often provided by online banks."
"How can I plan for retirement if I don't have access to a 401(k) or employer-sponsored plan?","You can plan for retirement without employer-sponsored plans by opening an individual retirement account (IRA), saving regularly, and considering other investment options."
"What is a financial advisor's role, and when should I consider seeking one?","A financial advisor can help with various financial tasks, including investment planning, retirement planning, and estate planning. Consider seeking one when you have complex financial needs or lack the time or expertise to manage your finances effectively."
"How can I set and prioritize financial goals for different life stages?","Setting and prioritizing financial goals involves considering your current situation and future aspirations. Create a list of short-term, mid-term, and long-term goals and develop a plan to achieve them."
"What is the importance of having a rainy-day fund separate from an emergency fund?","A rainy-day fund is a smaller, short-term savings account for minor unexpected expenses, while an emergency fund is for more significant financial crises. Keeping them separate helps you manage your finances more efficiently."
"How can I build good credit from scratch?","To build good credit from scratch, consider a secured credit card, become an authorized user on someone else's credit card, or take out a credit-builder loan. Make on-time payments and keep credit utilization low."
"How can I track my expenses and stay within my budget?","You can track expenses by using budgeting apps or spreadsheets, reviewing bank and credit card statements, and categorizing expenses. Staying within your budget requires discipline and making adjustments as needed."
"What is the importance of saving for children's education, and what are the options available?","Saving for children's education is crucial to provide them with opportunities. Options include 529 plans, custodial accounts (UTMA/UGMA), Coverdell Education Savings Accounts (ESA), and regular investment accounts."
"How is a credit score calculated?","Your credit score is calculated based on the information in your credit report. The main factors that influence your score are payment history, credit utilization, credit history length, new credit, and credit mix. Good credit practices like paying on time and keeping balances low will help raise your score over time."